[
  {
    "id": "bm5_buff_purple_guard",
    "name": "????",
    "type": "buff",
    "stackable": false,
    "max_stacks": 1,
    "default_duration": 4.0,
    "effects": [
      {
        "op": "damage_reduce_percent",
        "value": 0.16
      }
    ],
    "tick_effects": [],
    "tick_interval": 0.0
  },
  {
    "id": "bm5_buff_purple_combo",
    "name": "????",
    "type": "buff",
    "stackable": true,
    "max_stacks": 3,
    "default_duration": 4.0,
    "effects": [
      {
        "op": "attack_speed_bonus",
        "value": 0.1
      }
    ],
    "tick_effects": [],
    "tick_interval": 0.0
  },
  {
    "id": "bm5_buff_purple_focus",
    "name": "????",
    "type": "buff",
    "stackable": false,
    "max_stacks": 1,
    "default_duration": 5.0,
    "effects": [
      {
        "op": "crit_bonus",
        "value": 0.14
      }
    ],
    "tick_effects": [],
    "tick_interval": 0.0
  },
  {
    "id": "bm5_buff_purple_heal",
    "name": "????",
    "type": "buff",
    "stackable": false,
    "max_stacks": 1,
    "default_duration": 4.0,
    "effects": [
      {
        "op": "healing_amp",
        "value": 0.2
      },
      {
        "op": "hp_regen_add",
        "value": 18
      }
    ],
    "tick_effects": [],
    "tick_interval": 0.0
  },
  {
    "id": "bm5_buff_purple_array",
    "name": "????",
    "type": "buff",
    "stackable": false,
    "max_stacks": 1,
    "default_duration": 5.0,
    "effects": [
      {
        "op": "damage_amp_percent",
        "value": 0.14
      }
    ],
    "tick_effects": [],
    "tick_interval": 0.0
  },
  {
    "id": "bm5_debuff_purple_slow",
    "name": "????",
    "type": "debuff",
    "stackable": false,
    "max_stacks": 1,
    "default_duration": 3.0,
    "effects": [
      {
        "op": "stat_add",
        "stat": "spd",
        "value": -22
      }
    ],
    "tick_effects": [],
    "tick_interval": 0.0
  },
  {
    "id": "bm5_debuff_purple_bleed",
    "name": "????",
    "type": "debuff",
    "stackable": true,
    "max_stacks": 3,
    "default_duration": 5.0,
    "effects": [],
    "tick_effects": [
      {
        "op": "damage_target",
        "value": 36,
        "damage_type": "external"
      }
    ],
    "tick_interval": 1.0
  },
  {
    "id": "bm5_debuff_purple_burn",
    "name": "????",
    "type": "debuff",
    "stackable": true,
    "max_stacks": 3,
    "default_duration": 5.0,
    "effects": [],
    "tick_effects": [
      {
        "op": "damage_target",
        "value": 32,
        "damage_type": "internal"
      }
    ],
    "tick_interval": 1.0
  }
]
