[
  {
    "id": "bm5_buff_guard",
    "name": "Xuanjia Guard",
    "type": "buff",
    "stackable": false,
    "max_stacks": 1,
    "default_duration": 3.0,
    "effects": [
      {
        "op": "damage_reduce_percent",
        "value": 0.08
      }
    ],
    "tick_effects": [],
    "tick_interval": 0.0
  },
  {
    "id": "bm5_buff_vanguard_stance",
    "name": "Mountain Stance",
    "type": "buff",
    "stackable": false,
    "max_stacks": 1,
    "default_duration": 3.0,
    "effects": [
      {
        "op": "stat_add",
        "stat": "def",
        "value": 16
      }
    ],
    "tick_effects": [],
    "tick_interval": 0.0
  },
  {
    "id": "bm5_buff_sword_momentum",
    "name": "Sword Momentum",
    "type": "buff",
    "stackable": true,
    "max_stacks": 3,
    "default_duration": 4.0,
    "effects": [
      {
        "op": "attack_speed_bonus",
        "value": 0.06
      }
    ],
    "tick_effects": [],
    "tick_interval": 0.0
  },
  {
    "id": "bm5_buff_shadow_edge",
    "name": "Shadow Edge",
    "type": "buff",
    "stackable": false,
    "max_stacks": 1,
    "default_duration": 4.0,
    "effects": [
      {
        "op": "crit_bonus",
        "value": 0.08
      }
    ],
    "tick_effects": [],
    "tick_interval": 0.0
  },
  {
    "id": "bm5_buff_arrow_focus",
    "name": "Arrow Focus",
    "type": "buff",
    "stackable": false,
    "max_stacks": 1,
    "default_duration": 4.0,
    "effects": [
      {
        "op": "range_add",
        "value": 1
      }
    ],
    "tick_effects": [],
    "tick_interval": 0.0
  },
  {
    "id": "bm5_buff_caster_resonance",
    "name": "Caster Resonance",
    "type": "buff",
    "stackable": false,
    "max_stacks": 1,
    "default_duration": 4.0,
    "effects": [
      {
        "op": "damage_amp_percent",
        "value": 0.08
      }
    ],
    "tick_effects": [],
    "tick_interval": 0.0
  },
  {
    "id": "bm5_buff_healer_bless",
    "name": "Healer Bless",
    "type": "buff",
    "stackable": false,
    "max_stacks": 1,
    "default_duration": 4.0,
    "effects": [
      {
        "op": "healing_amp",
        "value": 0.12
      },
      {
        "op": "hp_regen_add",
        "value": 10
      }
    ],
    "tick_effects": [],
    "tick_interval": 0.0
  },
  {
    "id": "bm5_buff_leader_aura",
    "name": "Leader Aura",
    "type": "buff",
    "stackable": false,
    "max_stacks": 1,
    "default_duration": 8.0,
    "effects": [
      {
        "op": "stat_percent",
        "stat": "atk",
        "value": 0.08
      }
    ],
    "tick_effects": [],
    "tick_interval": 0.0
  },
  {
    "id": "bm5_debuff_slow",
    "name": "Slow",
    "type": "debuff",
    "stackable": false,
    "max_stacks": 1,
    "default_duration": 3.0,
    "effects": [
      {
        "op": "stat_add",
        "stat": "spd",
        "value": -12
      }
    ],
    "tick_effects": [],
    "tick_interval": 0.0
  },
  {
    "id": "bm5_debuff_bleed",
    "name": "Bleed",
    "type": "debuff",
    "stackable": true,
    "max_stacks": 3,
    "default_duration": 4.0,
    "effects": [],
    "tick_effects": [
      {
        "op": "damage_target",
        "value": 22,
        "damage_type": "external"
      }
    ],
    "tick_interval": 1.0
  },
  {
    "id": "bm5_debuff_burn",
    "name": "Burn",
    "type": "debuff",
    "stackable": true,
    "max_stacks": 3,
    "default_duration": 4.0,
    "effects": [],
    "tick_effects": [
      {
        "op": "damage_target",
        "value": 18,
        "damage_type": "internal"
      }
    ],
    "tick_interval": 1.0
  }
]