[
  {
    "id": "boss_shield",
    "name": "Boss 护盾",
    "type": "buff",
    "stackable": false,
    "max_stacks": 1,
    "default_duration": 99.0,
    "effects": [],
    "tick_effects": [],
    "tick_interval": 0.0
  },
  {
    "id": "boss_immune",
    "name": "Boss 免伤",
    "type": "buff",
    "stackable": false,
    "max_stacks": 1,
    "default_duration": 8.0,
    "effects": [
      { "op": "damage_reduce_percent", "value": 0.95 }
    ],
    "tick_effects": [],
    "tick_interval": 0.0
  },
  {
    "id": "boss_atk_up_20",
    "name": "Boss 破盾增伤",
    "type": "buff",
    "stackable": true,
    "max_stacks": 3,
    "default_duration": 99.0,
    "effects": [
      { "op": "stat_percent", "stat": "atk", "value": 0.2 },
      { "op": "stat_percent", "stat": "iat", "value": 0.2 }
    ],
    "tick_effects": [],
    "tick_interval": 0.0
  },
  {
    "id": "boss_soft_enrage_1",
    "name": "Boss 轻度狂暴 I",
    "type": "buff",
    "stackable": false,
    "max_stacks": 1,
    "default_duration": 99.0,
    "effects": [
      { "op": "stat_percent", "stat": "atk", "value": 0.3 },
      { "op": "attack_speed_bonus", "value": 0.15 }
    ],
    "tick_effects": [],
    "tick_interval": 0.0
  },
  {
    "id": "boss_soft_enrage_2",
    "name": "Boss 轻度狂暴 II",
    "type": "buff",
    "stackable": false,
    "max_stacks": 1,
    "default_duration": 99.0,
    "effects": [
      { "op": "stat_percent", "stat": "atk", "value": 0.6 },
      { "op": "attack_speed_bonus", "value": 0.25 },
      { "op": "damage_reduce_percent", "value": 0.15 }
    ],
    "tick_effects": [],
    "tick_interval": 0.0
  },
  {
    "id": "boss_full_enrage",
    "name": "Boss 完全狂暴",
    "type": "buff",
    "stackable": false,
    "max_stacks": 1,
    "default_duration": 99.0,
    "effects": [
      { "op": "stat_percent", "stat": "atk", "value": 1.0 },
      { "op": "attack_speed_bonus", "value": 0.35 },
      { "op": "damage_reduce_percent", "value": 0.25 }
    ],
    "tick_effects": [],
    "tick_interval": 0.0
  }
]
