[
  {
    "id": "bm5_debuff_terrain_scorch",
    "name": "????",
    "type": "debuff",
    "stackable": true,
    "max_stacks": 3,
    "default_duration": 3.0,
    "effects": [
      {
        "op": "stat_add",
        "stat": "def",
        "value": -10
      }
    ],
    "tick_effects": [
      {
        "op": "damage_target",
        "value": 12,
        "damage_type": "internal"
      }
    ],
    "tick_interval": 1.0
  },
  {
    "id": "bm5_debuff_terrain_frostbite",
    "name": "??",
    "type": "debuff",
    "stackable": false,
    "max_stacks": 1,
    "default_duration": 2.5,
    "effects": [
      {
        "op": "stat_add",
        "stat": "spd",
        "value": -18
      }
    ],
    "tick_effects": [],
    "tick_interval": 0.0
  },
  {
    "id": "bm5_buff_terrain_qi_flow",
    "name": "????",
    "type": "buff",
    "stackable": false,
    "max_stacks": 1,
    "default_duration": 2.0,
    "effects": [
      {
        "op": "stat_add",
        "stat": "wis",
        "value": 12
      },
      {
        "op": "healing_amp",
        "value": 0.08
      }
    ],
    "tick_effects": [],
    "tick_interval": 0.0
  }
]
