[
  {
    "id": "buff_iron_skin",
    "name": "Iron Skin",
    "type": "buff",
    "icon": "buff_shield",
    "stackable": false,
    "max_stacks": 1,
    "default_duration": 4.0,
    "effects": [
      {"op": "damage_reduce_percent", "value": 0.40},
      {"op": "thorns_percent", "value": 0.15}
    ],
    "tick_effects": [],
    "tick_interval": 0
  },
  {
    "id": "buff_berserk",
    "name": "Berserk",
    "type": "buff",
    "icon": "buff_rage",
    "stackable": true,
    "max_stacks": 5,
    "default_duration": 6.0,
    "effects": [
      {"op": "stat_percent", "stat": "atk", "value": 0.10},
      {"op": "attack_speed_bonus", "value": 0.10},
      {"op": "stat_percent", "stat": "def", "value": -0.05}
    ],
    "tick_effects": [],
    "tick_interval": 0
  },
  {
    "id": "buff_bloodthirst",
    "name": "Bloodthirst",
    "type": "buff",
    "icon": "buff_vampire",
    "stackable": false,
    "max_stacks": 1,
    "default_duration": 5.0,
    "effects": [
      {"op": "vampire", "value": 0.25},
      {"op": "stat_percent", "stat": "atk", "value": 0.15}
    ],
    "tick_effects": [],
    "tick_interval": 0
  },
  {
    "id": "buff_wind_walk",
    "name": "Wind Walk",
    "type": "buff",
    "icon": "buff_spd",
    "stackable": false,
    "max_stacks": 1,
    "default_duration": 3.0,
    "effects": [
      {"op": "stat_percent", "stat": "spd", "value": 0.50},
      {"op": "dodge_bonus", "value": 0.30}
    ],
    "tick_effects": [],
    "tick_interval": 0
  },
  {
    "id": "buff_qi_shield",
    "name": "Qi Shield",
    "type": "buff",
    "icon": "buff_barrier",
    "stackable": false,
    "max_stacks": 1,
    "default_duration": 8.0,
    "effects": [
      {"op": "shield_on_combat_start", "value": 500},
      {"op": "damage_reduce_percent", "value": 0.10}
    ],
    "tick_effects": [],
    "tick_interval": 0
  },
  {
    "id": "buff_crit_aura",
    "name": "Crit Aura",
    "type": "buff",
    "icon": "buff_crit",
    "stackable": false,
    "max_stacks": 1,
    "default_duration": 5.0,
    "effects": [
      {"op": "crit_bonus", "value": 0.30},
      {"op": "crit_damage_bonus", "value": 0.40}
    ],
    "tick_effects": [],
    "tick_interval": 0
  },
  {
    "id": "buff_undying",
    "name": "Undying",
    "type": "buff",
    "icon": "buff_immortal",
    "stackable": false,
    "max_stacks": 1,
    "default_duration": 3.0,
    "effects": [
      {"op": "damage_reduce_percent", "value": 0.90}
    ],
    "tick_effects": [
      {"op": "heal_self", "value": 50}
    ],
    "tick_interval": 1.0
  },
  {
    "id": "buff_insight",
    "name": "Insight",
    "type": "buff",
    "icon": "buff_eye",
    "stackable": false,
    "max_stacks": 1,
    "default_duration": 4.0,
    "effects": [
      {"op": "damage_amp_vs_debuffed", "value": 0.30}
    ],
    "tick_effects": [],
    "tick_interval": 0
  },
  {
    "id": "buff_terrain_amp_damage",
    "name": "Terrain Damage Amp",
    "type": "buff",
    "icon": "buff_power",
    "stackable": false,
    "max_stacks": 1,
    "default_duration": 1.2,
    "effects": [
      {"op": "damage_amp_percent", "value": 0.20}
    ],
    "tick_effects": [],
    "tick_interval": 0
  },
  {
    "id": "tangmen_poison",
    "name": "Tangmen Poison",
    "type": "debuff",
    "icon": "debuff_poison",
    "stackable": true,
    "max_stacks": 5,
    "default_duration": 5.0,
    "effects": [
      {"op": "stat_percent", "stat": "def", "value": -0.08}
    ],
    "tick_effects": [
      {"op": "damage_target", "value": 22, "damage_type": "internal"}
    ],
    "tick_interval": 1.0
  },
  {
    "id": "debuff_bleed",
    "name": "Bleed",
    "type": "debuff",
    "icon": "debuff_bleed",
    "stackable": true,
    "max_stacks": 5,
    "default_duration": 5.0,
    "effects": [
      {"op": "stat_percent", "stat": "def", "value": -0.05}
    ],
    "tick_effects": [
      {"op": "damage_target", "value": 25, "damage_type": "external"}
    ],
    "tick_interval": 1.0
  },
  {
    "id": "debuff_burn",
    "name": "Burn",
    "type": "debuff",
    "icon": "debuff_fire",
    "stackable": true,
    "max_stacks": 3,
    "default_duration": 4.0,
    "effects": [
      {"op": "stat_percent", "stat": "idr", "value": -0.10}
    ],
    "tick_effects": [
      {"op": "damage_target", "value": 35, "damage_type": "internal"}
    ],
    "tick_interval": 1.0
  },
  {
    "id": "debuff_freeze",
    "name": "Freeze",
    "type": "debuff",
    "icon": "debuff_ice",
    "stackable": false,
    "max_stacks": 1,
    "default_duration": 2.0,
    "effects": [
      {"op": "stat_percent", "stat": "spd", "value": -1.0},
      {"op": "attack_speed_bonus", "value": -1.0}
    ],
    "tick_effects": [],
    "tick_interval": 0
  },
  {
    "id": "debuff_slow",
    "name": "Slow",
    "type": "debuff",
    "icon": "debuff_slow",
    "stackable": true,
    "max_stacks": 3,
    "default_duration": 4.0,
    "effects": [
      {"op": "stat_percent", "stat": "spd", "value": -0.20},
      {"op": "attack_speed_bonus", "value": -0.15}
    ],
    "tick_effects": [],
    "tick_interval": 0
  },
  {
    "id": "debuff_armor_break",
    "name": "Armor Break",
    "type": "debuff",
    "icon": "debuff_armor_break",
    "stackable": true,
    "max_stacks": 5,
    "default_duration": 6.0,
    "effects": [
      {"op": "stat_percent", "stat": "def", "value": -0.15},
      {"op": "stat_percent", "stat": "idr", "value": -0.15}
    ],
    "tick_effects": [],
    "tick_interval": 0
  },
  {
    "id": "debuff_silence",
    "name": "Silence",
    "type": "debuff",
    "icon": "debuff_silence",
    "stackable": false,
    "max_stacks": 1,
    "default_duration": 3.0,
    "effects": [
      {"op": "stat_percent", "stat": "mp", "value": -1.0}
    ],
    "tick_effects": [],
    "tick_interval": 0
  },
  {
    "id": "debuff_fear",
    "name": "Fear",
    "type": "debuff",
    "icon": "debuff_fear",
    "stackable": false,
    "max_stacks": 1,
    "default_duration": 2.5,
    "effects": [
      {"op": "stat_percent", "stat": "atk", "value": -0.30},
      {"op": "stat_percent", "stat": "def", "value": -0.20}
    ],
    "tick_effects": [],
    "tick_interval": 0
  },
  {
    "id": "debuff_mark_death",
    "name": "Death Mark",
    "type": "debuff",
    "icon": "debuff_mark",
    "stackable": false,
    "max_stacks": 1,
    "default_duration": 6.0,
    "effects": [
      {"op": "damage_reduce_percent", "value": -0.20}
    ],
    "tick_effects": [],
    "tick_interval": 0
  },
  {
    "id": "debuff_exhaust",
    "name": "Exhaust",
    "type": "debuff",
    "icon": "debuff_exhaust",
    "stackable": true,
    "max_stacks": 3,
    "default_duration": 5.0,
    "effects": [
      {"op": "stat_percent", "stat": "atk", "value": -0.15},
      {"op": "stat_percent", "stat": "iat", "value": -0.15},
      {"op": "attack_speed_bonus", "value": -0.10}
    ],
    "tick_effects": [],
    "tick_interval": 0
  },
  {
    "id": "debuff_vulnerable",
    "name": "Vulnerable",
    "type": "debuff",
    "icon": "debuff_vulnerable",
    "stackable": true,
    "max_stacks": 3,
    "default_duration": 5.0,
    "effects": [
      {"op": "damage_reduce_percent", "value": -0.15}
    ],
    "tick_effects": [],
    "tick_interval": 0
  }
]
