[
  {
    "id": "jiuyang_shield",
    "name": "九阳护体",
    "type": "buff",
    "icon": "buff_golden_shield",
    "stackable": false,
    "max_stacks": 1,
    "default_duration": 5.0,
    "effects": [
      {
        "op": "damage_reduce_percent",
        "value": 0.3
      },
      {
        "op": "stat_percent",
        "stat": "def",
        "value": 0.2
      }
    ],
    "tick_effects": [],
    "tick_interval": 0
  },
  {
    "id": "tangmen_poison",
    "name": "唐门剧毒",
    "type": "debuff",
    "icon": "debuff_poison",
    "stackable": true,
    "max_stacks": 5,
    "default_duration": 4.0,
    "effects": [
      {
        "op": "stat_percent",
        "stat": "spd",
        "value": -0.15
      }
    ],
    "tick_effects": [
      {
        "op": "damage_target",
        "value": 30,
        "damage_type": "internal"
      }
    ],
    "tick_interval": 1.0
  },
  {
    "id": "lingbo_evasion",
    "name": "凌波回风",
    "type": "buff",
    "icon": "buff_wind_step",
    "stackable": false,
    "max_stacks": 1,
    "default_duration": 2.0,
    "effects": [
      {
        "op": "dodge_bonus",
        "value": 0.22
      }
    ],
    "tick_effects": [],
    "tick_interval": 0
  },
  {
    "id": "huagong_drain",
    "name": "化功蚀气",
    "type": "debuff",
    "icon": "debuff_drain",
    "stackable": true,
    "max_stacks": 3,
    "default_duration": 4.0,
    "effects": [
      {
        "op": "stat_percent",
        "stat": "atk",
        "value": -0.12
      },
      {
        "op": "stat_percent",
        "stat": "iat",
        "value": -0.12
      }
    ],
    "tick_effects": [
      {
        "op": "damage_target",
        "value": 22,
        "damage_type": "internal"
      }
    ],
    "tick_interval": 1.0
  },
  {
    "id": "tiangang_ward",
    "name": "天罡护体",
    "type": "buff",
    "icon": "buff_star_ward",
    "stackable": false,
    "max_stacks": 1,
    "default_duration": 2.0,
    "effects": [
      {
        "op": "stat_percent",
        "stat": "def",
        "value": 0.2
      },
      {
        "op": "damage_reduce_percent",
        "value": 0.08
      }
    ],
    "tick_effects": [],
    "tick_interval": 0
  },
  {
    "id": "taiji_guard",
    "name": "太极守势",
    "type": "buff",
    "icon": "buff_taiji_guard",
    "stackable": false,
    "max_stacks": 1,
    "default_duration": 4.0,
    "effects": [
      {
        "op": "damage_reduce_percent",
        "value": 0.15
      },
      {
        "op": "mp_regen_add",
        "value": 2.0
      }
    ],
    "tick_effects": [],
    "tick_interval": 0
  },
  {
    "id": "qiankun_redirect",
    "name": "挪移回旋",
    "type": "buff",
    "icon": "buff_yinyang",
    "stackable": false,
    "max_stacks": 1,
    "default_duration": 2.5,
    "effects": [
      {
        "op": "damage_reduce_percent",
        "value": 0.18
      },
      {
        "op": "crit_bonus",
        "value": 0.08
      }
    ],
    "tick_effects": [],
    "tick_interval": 0
  }
]
