[
  {
    "id": "bm5_buff_blue_guard",
    "name": "????",
    "type": "buff",
    "stackable": false,
    "max_stacks": 1,
    "default_duration": 4.0,
    "effects": [
      {
        "op": "damage_reduce_percent",
        "value": 0.12
      }
    ],
    "tick_effects": [],
    "tick_interval": 0.0
  },
  {
    "id": "bm5_buff_blue_combo",
    "name": "????",
    "type": "buff",
    "stackable": true,
    "max_stacks": 3,
    "default_duration": 4.0,
    "effects": [
      {
        "op": "attack_speed_bonus",
        "value": 0.08
      }
    ],
    "tick_effects": [],
    "tick_interval": 0.0
  },
  {
    "id": "bm5_buff_blue_focus",
    "name": "????",
    "type": "buff",
    "stackable": false,
    "max_stacks": 1,
    "default_duration": 5.0,
    "effects": [
      {
        "op": "crit_bonus",
        "value": 0.1
      }
    ],
    "tick_effects": [],
    "tick_interval": 0.0
  },
  {
    "id": "bm5_buff_blue_heal",
    "name": "????",
    "type": "buff",
    "stackable": false,
    "max_stacks": 1,
    "default_duration": 4.0,
    "effects": [
      {
        "op": "healing_amp",
        "value": 0.16
      },
      {
        "op": "hp_regen_add",
        "value": 14
      }
    ],
    "tick_effects": [],
    "tick_interval": 0.0
  },
  {
    "id": "bm5_buff_blue_array",
    "name": "????",
    "type": "buff",
    "stackable": false,
    "max_stacks": 1,
    "default_duration": 5.0,
    "effects": [
      {
        "op": "damage_amp_percent",
        "value": 0.1
      }
    ],
    "tick_effects": [],
    "tick_interval": 0.0
  },
  {
    "id": "bm5_debuff_blue_slow",
    "name": "??",
    "type": "debuff",
    "stackable": false,
    "max_stacks": 1,
    "default_duration": 3.0,
    "effects": [
      {
        "op": "stat_add",
        "stat": "spd",
        "value": -16
      }
    ],
    "tick_effects": [],
    "tick_interval": 0.0
  },
  {
    "id": "bm5_debuff_blue_bleed",
    "name": "??",
    "type": "debuff",
    "stackable": true,
    "max_stacks": 3,
    "default_duration": 5.0,
    "effects": [],
    "tick_effects": [
      {
        "op": "damage_target",
        "value": 28,
        "damage_type": "external"
      }
    ],
    "tick_interval": 1.0
  },
  {
    "id": "bm5_debuff_blue_burn",
    "name": "??",
    "type": "debuff",
    "stackable": true,
    "max_stacks": 3,
    "default_duration": 5.0,
    "effects": [],
    "tick_effects": [
      {
        "op": "damage_target",
        "value": 24,
        "damage_type": "internal"
      }
    ],
    "tick_interval": 1.0
  }
]